title,post_body,price,location,url,bedrooms,bathrooms,datetime,latitude,longitude,cats_allowed,dogs_allowed,geometry,district,post_length
"gorgeous 1 bed apartment available in clinton hill,","no broker’s fee! guarantors welcome gorgeous 1 bed apartment available in clinton hill, short walk from the c train at clinton & washington ave. the surrounding area is home to corner cafes, coffee shops, cool bars, great restaurants, and grocery stores! the unit features exposed brick, hardwood floors, large windows and much more. just steps away from pratt institute, a few blocks from the c train line and the s train line which connects you to the 2/3/4/5 train line, coffee shops, bars, restaurants, citi bike, groceries and much more key features: - full kitchen w/ dishwasher / living room area w/ exposed brick - 1 queen size bedroom - 1 full bathroom - pets welcome contact me today before it’s gone! mike b. 831-585-0112",2650,"clinton hill, near c train at clinton &amp; washington ave",https://newyork.craigslist.org/brk/apa/d/brooklyn-gorgeous-bed-apartment/7705256201.html,1,1.0,['2024-01-07 19:44'],40.683152,-73.957682,1,1,POINT (-73.957682 40.683152),Brooklyn,732.0
no fee: condo-level luxury for the morden lifestyle.,"no fee: condo-level luxury for the morden lifestyle. listing id #: 267888 price: $5,799 property type: apartment bedrooms: 2.0 bathrooms: 2.0 pets: pets ok building amenities bicycle room common outdoor space diplomats ok doorman elevator garage health club laundry lounge receiving room storage valet wifi subway apartment amenities dishwasher hardwood marble bath no fee renovated river view washer light city view skyline view this remarkable 2 bedroom 2 bathroom apartment boasts condo-level finishes that redefine modern luxury living. oak wood flooring adds timeless charm underfoot. chrome grohe fixtures throughout enhance both style and functionality. oversized windows, complete with roller shades, flood the space with natural light and offer breathtaking city views. with individually controlled heat & air, your comfort is personalized. the gourmet kitchen is a chef's dream with stainless steel bertazzoni appliances, quartz countertops & backsplash, a wood-paneled blomberg dishwasher, an in-cabinet microwave, and custom cabinetry with under-cabinet lighting. enjoy the convenience of an in-home washer & dryer and usb outlets integrated for modern living. indulge in spa-like bathrooms featuring overhead & handheld shower fixtures, floating shelving for storage, an illuminated vanity mirror, a spacious medicine cabinet, and italian porcelain tiling. pricing is subject to change daily. net price advertised. terms and conditions apply. building amenities bike storage driveway garage health club house keeping services laundry room pet services valet service wine cellar with proximity to the subway and bus lines, including the n r 4 5 6 w and e m trains, residents have easy access to the best the city offers. victoria nikiforova phone: (718) 314-2295 mobile: (718) 314-2295 fax: (212) 227-1120 email: vnikiforova@kw.com keller williams nyc   (718) 314-2295   (718) 314-2295   fax (212) 227-1120   vnikiforova@kw.com posted by realtymx™ to view, call or text victoria nikiforova at (718) 314-2295",5799,midtown east,https://newyork.craigslist.org/mnh/apa/d/new-york-no-fee-condo-level-luxury-for/7705254892.html,2,2.0,['2024-01-07 19:38'],40.756164,-73.965974,1,1,POINT (-73.965974 40.756164),Manhattan,2019.0
unfurnished 3br/2 bath row house w/garage - marble hill,"three bedroom/two bath private row house with attached garage and back patio.  approx 1400 sf. located in marble hill at the tip of manhattan/lower bronx.  walking distance to #1 subway at 225th street and to metro north.  unfurnished.  photos available upon request.  first floor includes entry way, a 3/4 bath and garage and w/d. second floor includes living room, dining room, kitchen and access to back patio. third floor includes large master bedroom, two smaller bedrooms plus one full bath.  rent is $3700/month plus utilities (except water paid by landlord). seeking one year lease (with potential to renew).   pets considered on a case by case basis.  no smoking of any kind.  credit and background check required. free web counter",3700,inwood / wash hts,https://newyork.craigslist.org/mnh/apa/d/new-york-unfurnished-3br-bath-row-house/7705254496.html,3,2.0,['2024-01-07 19:36'],40.8662,-73.9221,1,1,POINT (-73.9221 40.8662),Manhattan,740.0
one week 1/20-1/27 $600 or $100 per day,"1/20-1/27 $600 or $100 per day. netflix, amazon, hulu on tv. in the heart of uws. south facing and gets plenty of sunlight.",100,upper west side,https://newyork.craigslist.org/mnh/apa/d/new-york-one-week-or-100-per-day/7705252580.html,1,1.0,['2024-01-07 19:27'],40.78263,-73.974985,0,0,POINT (-73.974985 40.78263),Manhattan,123.0
"ues - spacious 2 bed 1 bath (close to the 4,5,6 & q)","spacious 2-bedroom apartment in the carnegie hill portion of the ues. highlights: - premium location close to multiple subway lines (4,5,6 & q). - washer/dryer in unit - exposed brick and high ceilings - large bathroom with tub & dual sinks - large kitchen with dishwasher & bar top seating",3995,upper east side,https://newyork.craigslist.org/mnh/apa/d/new-york-ues-spacious-bed-bath-close-to/7705251827.html,2,1.0,['2024-01-07 19:23'],40.785192,-73.951426,1,1,POINT (-73.951426 40.785192),Manhattan,290.0
3 br apt for rent,"3 br/1.5 bath for rent, 3 blocks to #a train lefferts blvd,",2950,south richmond hills,https://newyork.craigslist.org/que/apa/d/south-richmond-hill-br-apt-for-rent/7705250290.html,3,,['2024-01-07 19:16'],40.689181,-73.822246,0,0,POINT (-73.822246 40.689181),Queens,59.0
king bedrooms___hudson river views_______windows everywhere__,"king bedrooms___hudson river views_______windows everywhere__ for a tour please call/text me at 917-932-5174 listing id #: 231457 price: $5,670 property type: apartment bedrooms: 3.0 bathrooms: 2.0 floor: 10 pets: pets ok building amenities common outdoor space doorman elevator garage health club laundry pool storage subway valet apartment amenities city view dishwasher eat in kitchen granite kitchen hardwood high ceilings light marble bath no fee river view walk in closet this apartment features a beautifully renovated kitchen with closed quarters, complemented by elegant quartz countertops and sleek stainless steel appliances. hardwood floors and large windows create a warm and inviting living space experience the ultimate in upscale living at our newly refurbished waterfront sanctuary nestled in the heart of vibrant downtown manhattan. discover the allure of renovated units that offer a luxurious lifestyle, complete with awe-inspiring vistas, immediate access to the hudson river waterfront promenade, an exclusive park, and a sun-soaked, heated outdoor pool. elevate your everyday with top-tier amenities, including a cutting-edge fitness center featuring peloton® bikes, an expansive lounge, a rooftop oasis, and more. prime location 7 min walk to by 1,2,3, 4,5 subway lines, world-class shopping, dining, and entertainment right at your doorstep for more information please call/text me at 917-932-5174 or email me at leonardo@bouklisgroup.com leonardo mora phone: 212-402-7855 ext. 105 mobile: 917-932-5174 fax: 212-402-7856 email: leonardo@bouklisgroup.com the bouklis group   212-402-7855 ext. 105   917-932-5174   fax 212-402-7856   leonardo@bouklisgroup.com posted by realtymx™ to view, call or text leonardo mora at 917-932-5174",5670,battery park,https://newyork.craigslist.org/mnh/apa/d/new-york-king-bedroomshudson-river/7705249914.html,3,2.0,['2024-01-07 19:15'],40.709504,-74.015401,1,1,POINT (-74.015401 40.709504),Manhattan,1754.0
^^^ studio/ 1 bedroom and beautiful central park views,"bright studio/1 bedroom modern kitchen finishes. located in an elevator building with laundry room facility, fitness center and 24/7 doorman. located steps away central park and with close proximity to columbia university, new york presbyterian hospital, and mt. sinai hospital. conveniently close to whole foods, tj maxx, duane reade, chase bank, bank of america, home goods, crumbs, sephora, starbucks, petco and more. the neighborhood's transportation includes the west side subways (1, 2, 3, c, and b trains) 1 month fee paid by property management.",3000,upper west side,https://newyork.craigslist.org/mnh/apa/d/new-york-studio-bedroom-and-beautiful/7705249242.html,1,1.0,['2024-01-07 19:12'],40.792726,-73.967729,1,1,POINT (-73.967729 40.792726),Manhattan,553.0
11 x 13 bedrooms_______doorman_______water viewqs___,"king bedrooms_______doorman_______water viewqs___ for a tour please call/text me t 917-932-5174 listing id #: 231459 price: $3,700 property type: apartment bedrooms: 2.0 bathrooms: 1.0 floor: 10 pets: pets ok building amenities common outdoor space doorman elevator garage health club laundry pool storage subway valet apartment amenities city view dishwasher eat in kitchen granite kitchen hardwood high ceilings light marble bath river view walk in closet this apartment features a beautifully renovated kitchen with closed quarters, complemented by elegant quartz countertops and sleek stainless steel appliances. hardwood floors and large windows create a warm and inviting living space experience the ultimate in upscale living at our newly refurbished waterfront sanctuary nestled in the heart of vibrant downtown manhattan. discover the allure of renovated units that offer a luxurious lifestyle, complete with awe-inspiring vistas, immediate access to the hudson river waterfront promenade, an exclusive park, and a sun-soaked, heated outdoor pool. elevate your everyday with top-tier amenities, including a cutting-edge fitness center featuring peloton® bikes, an expansive lounge, a rooftop oasis, and more. prime location 7 min walk to by 1,2,3, 4,5 subway lines, world-class shopping, dining, and entertainment right at your doorstep. this is a large 1 bedroom flex 2 for more information please call/text me at 917-932-5174 or email me at leonardo@bouklisgroup.com leonardo mora phone: 212-402-7855 ext. 105 mobile: 917-932-5174 fax: 212-402-7856 email: leonardo@bouklisgroup.com the bouklis group   212-402-7855 ext. 105   917-932-5174   fax 212-402-7856   leonardo@bouklisgroup.com posted by realtymx™ to view, call or text leonardo mora at 917-932-5174",3700,battery park,https://newyork.craigslist.org/mnh/apa/d/new-york-11-13-bedroomsdoormanwater/7705246370.html,2,1.0,['2024-01-07 19:01'],40.709699,-74.014801,1,1,POINT (-74.014801 40.709699),Manhattan,1768.0
"water viiew____no fee!!!____steps to 4,5,2,3,1 trains_________","water viiew____no fee!!!____steps to 4,5,2,3,1 trains_________ for a tour please call/text me at 917-932-5174 listing id #: 231388 price: $3,050 property type: apartment bedrooms: 1.0 (water views) bathrooms: 1.0 floor: 25 pets: pets ok building amenities concierge doorman elevator health club laundry lounge roof deck wifi apartment amenities city view eat in kitchen granite kitchen hardwood high ceilings light loft marble bath no fee renovated river view walk in closet apartment flex 1 boasts a separated kitchen and living room, providing a spacious and functional layout for its residents. the kitchen has been updated with granite countertops and stainless steel appliances, and the apartment also features extra closets for added storage. large windows allow for plenty of natural light to flood the space, creating a bright and inviting atmosphere. not only is the apartment itself in excellent condition, but the building's location is also highly convenient. it is just steps away from many subway lines, the path, buses, and two major expressways, making it easy to get around the city. building amenities include a fitness center, 24/7 doorman, laundry on every floor, valet service, concierge, parking garage, terrace, massive lounge, free wi-fi and even pool tables. making it a great option for those who love to stay active and social or even those who love to relax and unwind, all these features make this building a prime destination for anyone looking for a high-quality apartment in the city. for more information please call or text me at anytime at 917-932-5174 or email me at 917-932-5174 leonardo mora phone: 212-402-7855 ext. 105 mobile: 917-932-5174 fax: 212-402-7856 email: leonardo@bouklisgroup.com the bouklis group   212-402-7855 ext. 105   917-932-5174   fax 212-402-7856   leonardo@bouklisgroup.com posted by realtymx™ to view, call or text leonardo mora at 917-932-5174",3050,financial district,https://newyork.craigslist.org/mnh/apa/d/new-york-water-viiewno-feesteps-to/7705246361.html,1,1.0,['2024-01-07 19:01'],40.709572,-74.015204,1,1,POINT (-74.015204 40.709572),Manhattan,1906.0
huge duplex🔹️large bdrms🔹️large living space🔹️w/d in unit💥no f,"2000 sqft huge duplex immense bedrooms & living space with private backyard. located in prime bed-stuy. gorgeous hardwood floors new cabinets & kitchen cabinet space extremely spacious common area tons of natural sunlight & outdoor space huge private backyard pets allowed exposed brick and vaulted ceilings. washer & dryer in unit close to the j-m-z and bars, shopping and restaurants galore at myrtle ave are minutes away! showing by appointment only please text 929-548-2104 i have more options in williamsburg, bushwick, bedford stuyvesant, crown heights, flatbush, and other brooklyn areas feel free to reach out to me call or text 929-548-2104",4900,"bedford stuyvesant j,m,z, subway lines",https://newyork.craigslist.org/brk/apa/d/brooklyn-huge-duplexlarge-bdrmslarge/7705245051.html,5,2.0,['2024-01-07 18:55'],40.691629,-73.93633,1,1,POINT (-73.93633 40.691629),Brooklyn,649.0
🌟large🔹️new renovated🔹️new appliances🔹2 private bathrooms🔹️,"bushwick 2 bed 2 full bath new apartment. this apartment features a private full bath in each one of the queen size bedrooms. located in east williamsburg and just a short walk to the flushing ave j, m, z trains. new apartment with all stainless steel appliances modern kitchen central ac and oak floors. showing by appointment only please text 929-548-2104 i have more options in williamsburg, bushwick, bedford stuyvesant, crown heights, flatbush, and other brooklyn areas feel free to reach out to me call or text 929-548-2104",2995,"prime bushwick next to j,m,z subway",https://newyork.craigslist.org/brk/apa/d/brooklyn-largenew-renovatednew/7705244936.html,2,2.0,['2024-01-07 18:55'],40.699291,-73.937515,1,1,POINT (-73.937515 40.699291),Brooklyn,529.0
🔹️luxury large living room & bedrooms ●lots of sunlight☀️watch video,"watch video https://www.dropbox.com/s/lj8pyqmml1tzdz9/4a.mov?dl=0 largest 4 bedroom in the area! great space with windows in the living room, full open living room, large bedrooms and 3 full bathrooms! new updated building with roof top access, laundry on site this unit comes with a amazing living room with windows and extra closet space, so much space and sunlight, a must see! hardwood floors, video intercom system showing by appointment only please text 929-548-2104 i have more options in williamsburg, bushwick, bedford stuyvesant, crown heights, flatbush, and other brooklyn areas feel free to reach out to me call or text 929-548-2104 showing by appointment , no brokers fee",3600,flatbush - 2&amp;5 subway,https://newyork.craigslist.org/brk/apa/d/brooklyn-luxury-large-living-room/7705244777.html,4,3.0,['2024-01-07 18:54'],40.622623,-73.940266,1,1,POINT (-73.940266 40.622623),Brooklyn,684.0
cozy 3 bedroom on astoria blvd,"renovated three bedroom with two bedroom on the first floor of a house. new kitchen with new appliances and new bathroom. open house: by appointment only video: https://youtu.be/ntufhawfwzu if you’re able to attend the viewing, please text us you name and which day and time at (943) 218-2181 thank you,",3200,east elmhurst,https://newyork.craigslist.org/que/apa/d/east-elmhurst-cozy-bedroom-on-astoria/7705241031.html,3,1.0,['2024-01-07 18:38'],40.7613,-73.8739,0,0,POINT (-73.8739 40.7613),Queens,303.0
spacious two bedroom in east elmhurst,"beautiful spacious two bedroom with  two bathroom, available now to view! video: https://youtu.be/yokfnhyr3ok if you're able to attend the viewing, please text us you name and which day and time at  (943) 281-2181",2600,east elmhurst,https://newyork.craigslist.org/que/apa/d/east-elmhurst-spacious-two-bedroom-in/7705239477.html,2,2.0,['2024-01-07 18:32'],40.766957,-73.877134,0,0,POINT (-73.877134 40.766957),Queens,213.0
3br/1bath row house w/ garage - marble hill,"three bedroom/ one bathroom row house/carriage house in the marble hill section of bronx/manhattan.  approx 1300 sf. walking distance to the 225th street station for the #1 train.  three stories with entry foyer and garage on first floor.  living room, dining room, kitchen, plus access to back patio on second floor.  large master bedroom and two smaller bedrooms plus one full bathroom on third floor. includes attached garage, w/d and private back patio.  unfurnished. asking $3700/month plus utilities.    one year lease (with potential to renew).    photos upon request.  no brokers please. credit and background check required.  no smoking.  dogs and cats considered.",3700,marble hill bronx/manhattan,https://newyork.craigslist.org/brx/apa/d/bronx-3br-1bath-row-house-garage-marble/7705237716.html,3,,['2024-01-07 18:25'],40.8798,-73.9067,0,1,POINT (-73.9067 40.8798),Bronx,673.0
open house 1:30pm-2pm 01/08/24 1 bedroom studio,"studio 1 bedroom aptmt for rent $1950 mth.  eat in kitchen, bedroom and bathroom. landlord pays for water, tenant pays for electric. fully renovated ultramodern apartment with brand new ss appliances: stove, refrigerator, dishwasher and microwave.  granite counter tops.  split level ac/heat.  brand new bathroom with a window.  new floors, walls and ceilings. close to trains, buses and shopping. high 1st floor.  windows to the front. (917)992-7239 diana superior realty open house:   01/08/24    1:30pm-2pm",1950,brooklyn,https://newyork.craigslist.org/brk/apa/d/brooklyn-open-house-130pm-2pm-bedroom/7705237641.html,1,1.0,['2024-01-07 18:24'],40.5839,-73.9536,0,0,POINT (-73.9536 40.5839),Brooklyn,509.0
"🏙️✨ no fee luxury 2 bed, 1 bath in flatbush! ✨🏙️","contact jay for showing 646-570-3174 welcome to your stunning new home in a luxury building! this spacious 2 bed, 1 bath apartment is an urban oasis! 🌆 ✨ apartment features: - 🌞 flooded with natural light - 🏞️ short walk to prospect park - 🧳 modern fixtures & finishes - 🧺 laundry in-unit - 🍽️ stainless steel appliances 🏢 building amenities: - 🛗 elevator - 💪 gym - 🌇 furnished rooftop - 🧺 laundry in-unit - 🚪 virtual doorman 🚇 location highlights: - 🛍️ near shops & restaurants - 🚈 off the 2/5 line don't miss out on this urban paradise! contact us today to schedule a viewing. 📞🔑 requirement good credit and income guarantors welcomed",3100,brooklyn,https://newyork.craigslist.org/brk/apa/d/brooklyn-no-fee-luxury-bed-bath-in/7705236727.html,2,1.0,['2024-01-07 18:20'],40.6527,-73.9478,1,1,POINT (-73.9478 40.6527),Brooklyn,636.0
"🌟 *spacious, no fee 2 bed 1 bath in the heart of bushwick!* 🌟  welcome to","contact jay for showing 6465703174 welcome to your new home! this spacious 2br gem puts you right in the heart of bushwick, with a beautiful shared backyard to enjoy. ✨ features: - spacious living room 🛋️ - super high ceilings 🏠 - queen size rooms with closets! 👑🚪 - central ac & heat ❄️☀️ - laundry in building 🧺🏢 🌳 enjoy access to a shared, beautiful & large backyard! 🌳 🏙️ nearby everyday essentials including supermarkets, cafes, and tons of restaurants and shops! 🛒🍽️🛍️ requirement good credit and good income don't miss out on this amazing opportunity to live in the heart of bushwick! contact us now to schedule a viewing. 📞🔑",3000,brooklyn,https://newyork.craigslist.org/brk/apa/d/brooklyn-spacious-no-fee-bed-bath-in/7705236639.html,2,1.0,['2024-01-07 18:20'],40.691,-73.9194,1,1,POINT (-73.9194 40.691),Brooklyn,632.0
🌳 prime bushwick beauty: 3 🛏️ 2 🛁 apartmen_ no fee!!!,contact jay for showings 646-570-3174 spacious 3 bed 2 bath apartment located in sought after bushwick area. the unit has spacious rooms and offers a brick finish for desirable asteddics. steps away from the l train and close to manhattan. listing won’t last!!! requirement good credit and income contact jay for showing 646-570-3174,3200,brooklyn,https://newyork.craigslist.org/brk/apa/d/brooklyn-prime-bushwick-beauty-apartmen/7705236569.html,3,2.0,['2024-01-07 18:20'],40.6895,-73.906,1,1,POINT (-73.906 40.6895),Brooklyn,333.0
🌟🏙️ luxe living in bedford stuyvesant! w/ rooftop🏙️🌟no fee,"contact jay for showing 646-570-3174 welcome to your dream home in the heart of bedford stuyvesant! this stunning luxury 2 bed, 1 bath apartment is now available with no fee! ✨ ✨🏠 apartment features: - beautiful finishes - spacious layout - modern kitchen - stylish bathroom 🌟 building amenities: - 🎥 media room - 💪 gym - 🍸 lounge - 🐾 pet spa gross 3550 2 1/2 month free net 3015 18 month lease don't miss out on this rare opportunity to live in luxury! contact us today to schedule a viewing. 📞📅",3015,brooklyn,https://newyork.craigslist.org/brk/apa/d/brooklyn-luxe-living-in-bedford/7705236442.html,2,1.0,['2024-01-07 18:19'],40.6868,-73.9323,1,1,POINT (-73.9323 40.6868),Brooklyn,496.0
studio,tenant pays own gas and electricity staten island near new mall boulevard w2 forms for last two years and credit check one month rent and one month security.,1150,new dorp,https://newyork.craigslist.org/stn/apa/d/staten-island-studio/7705234582.html,0,1.0,['2024-01-07 18:13'],40.565476,-74.109285,1,0,POINT (-74.109285 40.565476),Staten Island,157.0
"""classic circa 1925 colonial house""","harrison, new york house for rent! ""circa 1925 classic colonial"" 3d matterport vtour view all matterport virtual tours @ csrealty.com/private/38929 3 bedrooms, 1.5 bath $5385 per month virtual tour â€œtrue to lifeâ€ 3d matterport virtual tours, these are embedded directly into our website. zero time to load,  consumer interactive with video. precise measurements that the consumer can take. live walk-thrus. if you have vr headset/goggles you can get a disney land type tour as if it is a lucid dream. welcome to the future of leasing real estate property! remarks: ""classic circa 1925 colonial home"" features - 3 bedrooms 1.5 bath on large level property w/patio, 2 car garage, new country kitchen, fireplace, wood floors, sunroom, basement storage, short walk to mtnrr and all shopping. we are pet friendly ! we have only quality rental properties and personally preview them not to waste your time looking at inadequate housing. visit our website where you can search 485 other rentals throughout westchester county! we also maintain a private rental inventory you will not get anywhere else!!. search them all @ csrealty.com contact listing agent: craig a. scher - lic. real estate broker, gri cell: (917) 921-4934 csrealty.com cs realty & relocation services nys licensed real estate brokers ""brokers of better rentals & residences"" westchester's premier residential leasing brokerage firm since 1986",5385,harrison,https://newyork.craigslist.org/wch/apa/d/harrison-classic-circa-1925-colonial/7705234514.html,3,,['2024-01-07 18:13'],40.9719,-73.7181,1,1,POINT (-73.7181 40.9719),,1407.0
garden apt - furn/unfurn - short or long term,"white plains, new york apartment for rent! ""furnished alcove studio"" 3d matterport vtour view all matterport virtual tours @ csrealty.com/private/38932 studio, 1 bath $1785 per month virtual tour â€œtrue to lifeâ€ 3d matterport virtual tours, these are embedded directly into our website. zero time to load,  consumer interactive with video. precise measurements that the consumer can take. live walk-thrus. if you have vr headset/goggles you can get a disney land type tour as if it is a lucid dream. welcome to the future of leasing real estate property! remarks: furn or unfurnished rental building - features: studio/alcove bedroom unit, short term leases ok, covered parking, laundry room, short walk to metro-north rr and shopping. we have only quality rental properties and personally preview them not to waste your time looking at inadequate housing. visit our website where you can search 485 other rentals throughout westchester county! we also maintain a private rental inventory you will not get anywhere else!!. search them all @ csrealty.com contact listing agent: craig a. scher - lic. real estate broker, gri cell: (917) 921-4934 csrealty.com cs realty & relocation services nys licensed real estate brokers ""brokers of better rentals & residences"" westchester's premier residential leasing brokerage firm since 1986",1785,white plains,https://newyork.craigslist.org/wch/apa/d/white-plains-garden-apt-furn-unfurn/7705234460.html,0,1.0,['2024-01-07 18:12'],41.0141,-73.7552,0,0,POINT (-73.7552 41.0141),,1332.0
