title,post_body,price,location,url,bedrooms,bathrooms,datetime,latitude,longitude,cats_allowed,dogs_allowed,geometry,district,post_length
gorgeous & sunny 2 -bedrooms + backyard,back on the market! great deal gorgeous & sunny 2 -bedrooms apartment available in bushwick | perfect for roommates or family huge private backyard! ( $200) located on the ground floor kitchen with custom cabinets ceramic tops stainless steel appliances dishwasher full of natural light bathroom has modern fixtures ceramic tiles and a soaking tub. hardwood floors central a/c closets throughout the unit. no broker fee! this gem is steps to everything the neighborhood has to offer! video available herel https://youtu.be/4xhgvp2jdmw available now tenant responsible for gas & electric bill call\text imri now for more info or scheduling,2799,prime bushwick,https://newyork.craigslist.org/brk/apa/d/brooklyn-gorgeous-sunny-bedrooms/7702260707.html,2,1.0,['2023-12-29 11:04'],40.688361,-73.916147,0,0,POINT (-73.916147 40.688361),Brooklyn,638.0
2 bed 1 bath available in crown heights,"washer/dryer in apartment! newly renovated, gorgeous, quiet, clean, very bright & sunny large 2 bedroom apartment. open kitchen with bar, includes new appliances including refrigerator, range, washer & dryer, white granite counter tops, back-splash and 42"" custom made gray cabinets with self closing doors. good credit and income required** guarantors welcome**",2895,crown heights,https://newyork.craigslist.org/brk/apa/d/brooklyn-bed-bath-available-in-crown/7702260105.html,2,1.0,['2023-12-29 11:02'],40.665763,-73.941464,1,1,POINT (-73.941464 40.665763),Brooklyn,362.0
11 bed 3 bath brownstone available in park slope,"make this beautiful victorian limestone townhouse located in the park slope area your home for the new year. this beautiful townhouse is a legal 2 family, features 11 bedrooms, 3 full bathrooms, 9 fireplaces, 2 kitchens, full basement, spacious backyard, and open 2 level porch area. the townhouse has hardwood floors throughout lots of classic mahogany woodwork. located within close proximity to the barclay center, whole foods, chick-fil-a, shack burger shake shack, trader joe’s, doughnut plants, restaurants, eateries, cafes and bars. ideal living location easy commute to downtown, brooklyn, midtown, and downtown financial center. trains orange lines b and d, green lines 4 and 5 express trains, yellow lines n,r and q lines. guarantors welcomed** feel free to reach out with and questions or to set up a showing!",15000,park slope,https://newyork.craigslist.org/brk/apa/d/brooklyn-11-bed-bath-brownstone/7702259707.html,8,3.0,['2023-12-29 11:01'],40.676537,-73.976719,1,1,POINT (-73.976719 40.676537),Brooklyn,820.0
"sunny bushwick loft on stockholm st, laundry, no fee!",this is a bright studio loft- top floor of a well kept loft building on stockholm street near the m train at central ave elevator i would say about 600 sq ft high ceilings owner will convert this open space to a one bedroom if requested laundry in building text amanda at 347.479.2829 to schedule a viewing no fee,2450,bushwick,https://newyork.craigslist.org/brk/apa/d/brooklyn-sunny-bushwick-loft-on/7702259537.html,0,1.0,['2023-12-29 11:01'],40.6988,-73.9235,1,1,POINT (-73.9235 40.6988),Brooklyn,313.0
3 bed 2 bath available in fort greene,"explore the charm of fort greene in this historic brownstone duplex! enjoy the warmth of exposed brick, two fireplaces, and a spacious living room. the private balcony with skylights offers a perfect retreat, and the apartment features a king-sized bedroom, a queen-sized bedroom, and a versatile full-sized bedroom/home office. with in-unit laundry and a new dishwasher, modern living meets classic comfort. pet-friendly too! guarantors welcomed** feel free to reach out with and questions or to set up a showing!",7000,fort greene,https://newyork.craigslist.org/brk/apa/d/brooklyn-bed-bath-available-in-fort/7702259434.html,3,2.0,['2023-12-29 11:01'],40.686105,-73.971119,1,1,POINT (-73.971119 40.686105),Brooklyn,514.0
renovated bright 3bed 1bath  boutique building| private yard.,"renovated, bright 3/1, boutique building with private yard. located on the first floor key features: - private yard ($150) - central air - spacious layout - windows throughout - private backyard space - few blocks to l train at livonia ave - 2, 3 and 4 trains at junius street station photos of similar unit in building need to know: - pet friendly unit amenities: - dishwasher - hardwood floors - microwave - private garden - stainless steel appliances - high ceilings - natural light - renovated bathroom - renovated kitchen -no fee video available here: https://youtu.be/ypo5xqxftg8 requirements: 650 + credit score, combined yearly income as to be at least 40 times the rent if providing guarantor income as to be 80 times the rent. will not last long call\text imri for more info          516-301-6843",2699,brownsville,https://newyork.craigslist.org/brk/apa/d/brooklyn-renovated-bright-3bed-1bath/7702259272.html,3,1.0,['2023-12-29 11:00'],40.6705,-73.894,0,0,POINT (-73.894 40.6705),Brooklyn,806.0
stunning studio with amenities! 🌇,"for quickest response, please text (516) 916-7655 with link to listing. stunning studio unit available at this time. this unit have hardwood floors, stylish kitchen and living area, stainless steel appliances, central ac and a virtual doorman system. most units feature private outdoor space. the building: the building boasts an elevator, well equipped gym, furnished roof deck with skyline views, laundry room, bike storage and amazon locker. parking is available for an additional monthly fee. the neighborhood: located in the heart of brooklyn, crown heights is a vibrant neighborhood that offers everything you could want or need – incredible restaurants, bars, shops and plenty of transportation options (2/3/4/s trains). not to mention you’ll be steps away from prospect park! brooklyn botanic garden could be your new backyard!",2400,brooklyn,https://newyork.craigslist.org/brk/apa/d/brooklyn-stunning-studio-with-amenities/7702259124.html,0,1.0,['2023-12-29 11:00'],40.668335,-73.957043,1,1,POINT (-73.957043 40.668335),Brooklyn,835.0
4 bed 2 bath available park slope,"discover your dream home in this 4-bed, 2-bath duplex with a basement and private backyard. revel in the blend of historical charm and modern convenience, featuring a spacious living room, elegant dining area, and a well-equipped kitchen. the private patio and backyard oasis provide the perfect settings for relaxation and entertainment. with exposed brick details adding character, this meticulously designed space invites you to create lasting memories. seize the chance to call this apartment your new home! guarantors welcomed** feel free to reach out with and questions or to set up a showing!",7000,park slope,https://newyork.craigslist.org/brk/apa/d/brooklyn-bed-bath-available-park-slope/7702259102.html,4,2.0,['2023-12-29 11:00'],40.680492,-73.976569,0,0,POINT (-73.976569 40.680492),Brooklyn,599.0
1 bed 1 bath available in bedstuy,"amazing 1 bedroom, 1 bathroom garden apartment in clinton hill, brooklyn. amenities include: private backyard and separate entrance, hardwood floors, stainless steel appliances, and laundry in building. one-half block from the subway. utilities included: heat and water. is pet friendly. date available: immediately. this property is managed by a responsible landlord and onsite building super. guarantors welcomed** feel free to reach out with and questions or to set up a showing!",3200,bedstuy,https://newyork.craigslist.org/brk/apa/d/brooklyn-bed-bath-available-in-bedstuy/7702258828.html,1,1.0,['2023-12-29 10:59'],40.680605,-73.957579,1,1,POINT (-73.957579 40.680605),Brooklyn,482.0
stunning 1br unit with amenities! 🌇,"for quickest response, please text (516) 916-7655 with link to listing. stunning 1 bed unit available at this time. this unit have hardwood floors, stylish kitchen and living area, stainless steel appliances, central ac and a virtual doorman system. most units feature private outdoor space. the building: the building boasts an elevator, well equipped gym, furnished roof deck with skyline views, laundry room, bike storage and amazon locker. parking is available for an additional monthly fee. the neighborhood: located in the heart of brooklyn, crown heights is a vibrant neighborhood that offers everything you could want or need – incredible restaurants, bars, shops and plenty of transportation options (2/3/4/s trains). not to mention you’ll be steps away from prospect park! brooklyn botanic garden could be your new backyard!",3000,brooklyn,https://newyork.craigslist.org/brk/apa/d/brooklyn-stunning-1br-unit-with/7702258799.html,1,1.0,['2023-12-29 10:59'],40.668416,-73.957043,1,1,POINT (-73.957043 40.668416),Brooklyn,834.0
stunning 2br unit with amenities! 🏡,"for quickest response, please text (516) 916-7655 with link to listing. stunning 2 bed unit available at this time. this unit have hardwood floors, stylish kitchen and living area, stainless steel appliances, central ac and a virtual doorman system. most units feature private outdoor space. the building: the building boasts an elevator, well equipped gym, furnished roof deck with skyline views, laundry room, bike storage and amazon locker. parking is available for an additional monthly fee. the neighborhood: located in the heart of brooklyn, crown heights is a vibrant neighborhood that offers everything you could want or need – incredible restaurants, bars, shops and plenty of transportation options (2/3/4/s trains). not to mention you’ll be steps away from prospect park! brooklyn botanic garden could be your new backyard!",3500,brooklyn,https://newyork.craigslist.org/brk/apa/d/brooklyn-stunning-2br-unit-with/7702258626.html,2,1.0,['2023-12-29 10:59'],40.6684,-73.957043,1,1,POINT (-73.957043 40.6684),Brooklyn,834.0
2 bed 1 bath available in brooklyn heights,"welcome to your new home at 45 pineapple street, nestled in the heart of the brooklyn heights historic district across from joe’s coffee! this pre-war building exudes charm, offering a spacious living experience in a vibrant neighborhood? lease details: - utilities included: electricity, internet, gas, heat and water - fully furnished: queen-size bed, tv, desk, chair, chest of drawers, twin size bed, night stand, couch, arm chair, etc. - updated kitchen with full size stainless steel appliances - renovated bathroom - hardwood floors - cats are welcome perfect location makes it easy to reach wonderful restaurants, shopping and transportation (right around the corner), and brooklyn bridge. trains: 2, 3, r, 4, 5, a, c, f.",4200,brooklyn heights,https://newyork.craigslist.org/brk/apa/d/brooklyn-bed-bath-available-in-brooklyn/7702258620.html,2,1.0,['2023-12-29 10:59'],40.698438,-73.994122,1,0,POINT (-73.994122 40.698438),Brooklyn,728.0
stunning 2br unit with modern amenities in vibrant crown heights! 🏡,"for quickest response, please text (516) 916-7655 with link to listing. stunning 2 bed unit available at this time. this unit have hardwood floors, stylish kitchen and living area, stainless steel appliances, central ac and a virtual doorman system. most units feature private outdoor space. the building: the building boasts an elevator, well equipped gym, furnished roof deck with skyline views, laundry room, bike storage and amazon locker. parking is available for an additional monthly fee. the neighborhood: located in the heart of brooklyn, crown heights is a vibrant neighborhood that offers everything you could want or need – incredible restaurants, bars, shops and plenty of transportation options (2/3/4/s trains). not to mention you’ll be steps away from prospect park! brooklyn botanic garden could be your new backyard!",3675,brooklyn,https://newyork.craigslist.org/brk/apa/d/brooklyn-stunning-2br-unit-with-modern/7702258468.html,2,1.0,['2023-12-29 10:58'],40.668367,-73.957,1,1,POINT (-73.957 40.668367),Brooklyn,834.0
stunning 2br unit with modern amenities in vibrant crown heights! 🏡,"for quickest response, please text (516) 916-7655 with link to listing. stunning 2 bed unit available at this time. this unit have hardwood floors, stylish kitchen and living area, stainless steel appliances, central ac and a virtual doorman system. most units feature private outdoor space. the building: the building boasts an elevator, well equipped gym, furnished roof deck with skyline views, laundry room, bike storage and amazon locker. parking is available for an additional monthly fee. the neighborhood: located in the heart of brooklyn, crown heights is a vibrant neighborhood that offers everything you could want or need – incredible restaurants, bars, shops and plenty of transportation options (2/3/4/s trains). not to mention you’ll be steps away from prospect park! brooklyn botanic garden could be your new backyard!",3675,brooklyn,https://newyork.craigslist.org/brk/apa/d/brooklyn-stunning-2br-unit-with-modern/7702258404.html,2,1.0,['2023-12-29 10:58'],40.668416,-73.957,1,1,POINT (-73.957 40.668416),Brooklyn,834.0
sunny 1br with private balcony & east river views! ☀️🏙️,"for quickest response, please text (516) 916-7655 with link to listing. sunny corner 1-bedroom home with a large private balcony overlooking cityscape. enjoy floor-to-ceiling sunlight washed windows with striking views of the east river and surrounding brooklyn. an outstanding apartment to call home, revel in an abundance of natural light, a well-appointed kitchen and bathroom, and well-crafted luxury finishes throughout.",5500,brooklyn,https://newyork.craigslist.org/brk/apa/d/brooklyn-sunny-1br-with-private-balcony/7702258086.html,1,1.0,['2023-12-29 10:57'],40.726558,-73.960048,1,1,POINT (-73.960048 40.726558),Brooklyn,425.0
below market apt in downtown brooklyn,"i just moved out of my apartment of 5+ years at 7 dekalb ave apt 18p. rent is about $800 below market for a one bedroom, one bathroom corner unit with really nice views of the verrazano and slightly obstructed views of the east river/new york harbor. i'm breaking my lease because i bought a place, but otherwise would have stayed longer. no washer/dryer in unit but there is a laundry room about 15 feet down the hall. there is a 24/7 concierge for packages, and the building is attached to target, trader joes and dekalb market. all subway lines are nearby as well. large dogs permitted (i had a 70lb dog and no issues at all). i do not have any direct ability to rent the unit but please look out for it to go back on market in the next week or so and apply!",3298,brooklyn,https://newyork.craigslist.org/brk/apa/d/brooklyn-below-market-apt-in-downtown/7702257941.html,1,1.0,['2023-12-29 10:57'],40.690003,-73.983134,1,1,POINT (-73.983134 40.690003),Brooklyn,761.0
luxury 2 bedrooms 2 baths apartment,"great deal! very rare luxury 2 bedrooms apartment located on the 5th floor 2 full bathrooms light fixtures hardwood floors dishwasher large living room high ceiling central a/c elevator building pets friendly beautiful rooftop access ** tenant responsible for electric water included pets friendly video available here: https://www.youtube.com/shorts/umflbb1t0j0 available dec 15 ** will not last long call\text imri for more info.      516-301-6843 650 + credit score, combined yearly income as to be at least 40 times the rent if providing guarantor income as to be 80 times the rent.",4199,prime williamsburg,https://newyork.craigslist.org/brk/apa/d/brooklyn-luxury-bedrooms-baths-apartment/7702257923.html,2,2.0,['2023-12-29 10:57'],40.709716,-73.95236,0,0,POINT (-73.95236 40.709716),Brooklyn,586.0
maspeth 1 bed! w/d in unit,"1 bed / 1 bath at 66-10 grand ave - unit: 4b in maspeth, queens. all pets allowed. nearby subway stations include: middle village - metropolitan av (m).",2600,maspeth,https://newyork.craigslist.org/que/apa/d/brooklyn-maspeth-bed-d-in-unit/7702257850.html,1,1.0,['2023-12-29 10:56'],40.6451,-73.945,0,0,POINT (-73.945 40.6451),Brooklyn,152.0
dramatic 2br loft with 12ft ceilings and floor-to-ceiling windows! 🌟,"for quickest response, please text (516) 916-7655 with link to listing. a new, dramatic, loft-like apartment with soaring 12-0 high ceilings and stunning floor-to-ceiling windows. this new, 2-bedroom and 2-bathroom home offers a spacious layout and eastern exposures. the primary bathroom features a large, stall shower and luxury finishes. ample closet storage is available throughout the apartment. the well-appointed kitchen flows into the living area for seamless entertaining and casual living.",6738,brooklyn,https://newyork.craigslist.org/brk/apa/d/brooklyn-dramatic-2br-loft-with-12ft/7702257823.html,2,2.0,['2023-12-29 10:56'],40.726519,-73.959939,1,1,POINT (-73.959939 40.726519),Brooklyn,499.0
unique 3br corner apartment with sundrenched views 🌞,"for quickest response, please text (516) 916-7655 with link to listing. a new, unique corner 3-bedroom, 2-bathroom sundrenched apartment with floor-to-ceiling windows facing south and east. enjoy this expansive layout and views of historic greenpoint, green spaces and the east river. the primary bedroom features a walk-in closet and ensuite bathroom. the well-appointed kitchen, spacious living room and luxury finishes throughout this home give new meaning to bespoke urban living.",8800,brooklyn,https://newyork.craigslist.org/brk/apa/d/brooklyn-unique-3br-corner-apartment/7702257555.html,3,2.0,['2023-12-29 10:56'],40.726568,-73.959897,1,1,POINT (-73.959897 40.726568),Brooklyn,484.0
luxury living in a historic movie theater conversion! 🎥✨,"for quickest response, please text (516) 916-7655 with link to listing. ultimate luxury living in this converted historic landmarked movie theater in ridgewood! 2 bedrooms, 1 full bath. fully equipped building featuring a gym, elevator, laundry room, pet spa, business conference center, and kid’s room. fully furnished patio with bbq and hammocks, and roof deck with skyline views. the apartments have central ac, dishwashers, and plenty of storage. top of the line appliances and finishes. truly breathtaking building. l/m trains at myrtle-wyckoff around the corner. milk & pull coffee, freda bar, bad old days bar, while in kathmandu, las chilangas, food bazaar, ridgewood ale house, etc nearby.",3529,queens,https://newyork.craigslist.org/que/apa/d/brooklyn-luxury-living-in-historic/7702257333.html,2,1.0,['2023-12-29 10:55'],40.700382,-73.907368,1,1,POINT (-73.907368 40.700382),Queens,698.0
spacious & bright junior 1br in prime east village! 🏡,"for quickest response, please text (516) 916-7655 with link to listing. come home to this spacious bright junior 1 bedroom apartment that can easily accommodate a queen sizes bed . perfect east-village location location around many restaurant and nightlife .",2900,east village,https://newyork.craigslist.org/mnh/apa/d/new-york-spacious-bright-junior-1br-in/7702256999.html,1,1.0,['2023-12-29 10:54'],40.728365,-73.985732,1,1,POINT (-73.985732 40.728365),Manhattan,258.0
cozy studio living at tower 77 🏢 serene waterfront views🌿,"for quickest response, please text (516) 916-7655 with link to listing. cozy studio unit living on tower 77 is a new landmark on the north edge of the greenpoint, brooklyn waterfront, situated between two great outdoor spaces – a beautiful, lushly landscaped inner court to the east, and the long anticipated box street park to the west. tower 77 is an air of timeless and modern distinction.",2632,brooklyn,https://newyork.craigslist.org/brk/apa/d/long-island-city-cozy-studio-living-at/7702256778.html,0,1.0,['2023-12-29 10:53'],40.737405,-73.956957,1,1,POINT (-73.956957 40.737405),Brooklyn,392.0
tranquil 3br haven in williamsburg! 🌆,"for quickest response, please text (516) 916-7655 with link to listing. elevated living in williamsburg’s finest locale uncover a new perspective on comfortable living, between keap street and rodney street. positioned on the second floor of a charming walk-up building, this recently renovated apartment mirrors the allure of its top-floor counterpart. revel in the inclusion of heat and hot water, ensuring a cozy and worry-free lifestyle. embrace the warm ambiance of a space flooded with natural light, creating a haven of tranquility. the kitchen, equipped with all-new appliances, becomes the heart of your daily routine, seamlessly blending modern convenience with timeless elegance. this thoughtfully designed residence radiates a refined yet relaxed atmosphere, offering a sanctuary just a step away from the vibrant city below. ideally situated just .2 miles from the j/m/z at marcy ave and .4 miles from the g/l at metropolitan avenue, this apartment balances serenity with unparalleled access to public transportation. seize the opportunity to make this your home, where every detail has been curated to enhance your living experience. available for immediate occupancy, immerse yourself in the spirit of williamsburg and make this exceptional unit your new address.",3400,brooklyn,https://newyork.craigslist.org/brk/apa/d/brooklyn-tranquil-3br-haven-in/7702256481.html,3,1.0,['2023-12-29 10:52'],40.709759,-73.955348,1,1,POINT (-73.955348 40.709759),Brooklyn,1278.0
"huge living room, updated kitchen in brooklyn heights gem! 🏡","for quickest response, please text (516) 916-7655 with link to listing. huge living room, semi open updated kitchen. great closet space. bathroom is off living room. glorious home in an elevator/laundry pre-war building in the most desired area of brooklyn heights. apartment is perfectly sized/spacious. recently renovated updated kitchen with full size stainless steel appliances and a dishwasher. hardwood floors. well-behaved pets are welcome. no building move-in/out fees are charged by the building. heat and water included in the rent. fantastic location makes it easy to reach wonderful restaurants, shopping and transportation (right around the corner), and brooklyn bridge. trains: 2, 3, r, 4, 5, a, c, f.",4900,brooklyn,https://newyork.craigslist.org/brk/apa/d/brooklyn-huge-living-room-updated/7702255929.html,2,1.0,['2023-12-29 10:51'],40.693492,-73.99292,1,1,POINT (-73.99292 40.693492),Brooklyn,715.0
spacious 2br at tower 77: greenpoint's new waterfront landmark! 🌇,"for quickest response, please text (516) 916-7655 with link to listing. spacious 2 bedroom unit living on tower 77 is a new landmark on the north edge of the greenpoint, brooklyn waterfront, situated between two great outdoor spaces – a beautiful, lushly landscaped inner court to the east, and the long anticipated box street park to the west. tower 77 is an air of timeless and modern distinction.",4419,brooklyn,https://newyork.craigslist.org/brk/apa/d/long-island-city-spacious-2br-at-tower/7702255603.html,2,1.0,['2023-12-29 10:50'],40.737616,-73.956957,1,1,POINT (-73.956957 40.737616),Brooklyn,399.0
gorgeous 2br apt. off the l dekalb! 🌟,"for quickest response, please text (516) 916-7655 with link to listing. a gorgeous 2 bedroom apt. right off the l dekalb!! ** 2 bright bedrooms ** awesome location ** high ceilings",2500,brooklyn,https://newyork.craigslist.org/brk/apa/d/brooklyn-gorgeous-2br-apt-off-the/7702255314.html,2,1.0,['2023-12-29 10:49'],40.701203,-73.920801,1,1,POINT (-73.920801 40.701203),Brooklyn,180.0
large 2 bedroom apt in windsor oaks bayside near all garden apt,"windsor oaks  large two (2) bedroom garden apt available , windsor oaks large living room ,large bedrooms ,excellent condition, full size kitchen ,  1st floor , best school district, available immediately, plenty of parking, please call 917-642-4765 $2225 available  immediately!!!!!! no email!!! located in bayside ny   75th ave / 220th street bayside nine one seven six four two four seven six five",2225,bayside,https://newyork.craigslist.org/que/apa/d/oakland-gardens-large-bedroom-apt-in/7702252445.html,2,1.0,['2023-12-29 10:41'],40.739027,-73.752862,0,0,POINT (-73.752862 40.739027),Queens,400.0
3 bedroom 2 bath duplex for rent,"3 bedroom two bathroom renovated duplex apartment for rent.  2 minute walk to equinox, 10 minute walk to greenwich station, 15 minute walk to greenwich avenue, 45 minute train ride to grand central station.  copy listing information below terms available date: 09/30/2021 duration: 12 months monthly rent: $4,750.00 security deposit: $6,000.00 features property type: condo beds: 3 baths: 2 full size: 1200 ft2 showing and application link https://www.hemlane.com/listings/57-oakridge-st-greenwich-ct-06830-usa-unit-a/66d63790-5731-4a70-b506-47beabf85502 description three bedroom / two bathroom two level unit available walking distance to greenwich ave, equinox, and greenwich train station - 40 minutes to grand central. leasing term flexible. text or email for details. off-street parking available for $50 / month requirements 620 credit, $14,250.00/month income additional features utilities resident pays heat resident pays electricity resident pays gas resident pays water trash pick-up included high-speed internet available pets small dogs allowed cats allowed appliances dishwasher air conditioning (wall unit) refrigerator range oven washer & dryer washer & dryer on-site microwave amenities unfurnished parking smoke free yard",4750,greenwich ct,https://newyork.craigslist.org/fct/apa/d/greenwich-bedroom-bath-duplex-for-rent/7702252074.html,3,2.0,['2023-12-29 10:40'],41.0427,-73.6262,1,1,POINT (-73.6262 41.0427),,1239.0
